### ISSUE TITLE
vector and tcp sink are unable to recover from killed tcp session, try to tcp retransmit forever

### ISSUE THREAD

**Issue by user318** [vectordotdev/vector#4933]
### Vector Version

```
vector 0.10.0 (g0f0311a x86_64-unknown-linux-musl 2020-07-22)
```

### Vector Configuration File

```toml
[sources.collectd]
type = "socket"
address = "0.0.0.0:2003"
mode = "tcp"

[transforms.update_host]
inputs = ["collectd"]
type = "lua"
version = "2"
hooks.init = "init"
hooks.process = "process"
timers = [ {interval_seconds = 5, handler = "timer_handler"} ]
search_dirs = ["/etc/vector/lua/"]
source = """
require('update_host')
"""

[sinks.out1]
inputs = ["update_host"]
type = "socket"
mode = "tcp"
encoding.codec = "text"
address = "10.0.0.1:2003"
healthcheck = false
buffer.type = "memory"
buffer.max = 10000
buffer.when_full = "drop_newest"

[sinks.out2]
inputs = ["update_host"]
type = "socket"
mode = "tcp"
encoding.codec = "text"
address = "10.0.0.1:2004"
healthcheck = false
buffer.type = "memory"
buffer.max = 10000
buffer.when_full = "drop_newest"

[sinks.out3]
inputs = ["update_host"]
type = "socket"
mode = "tcp"
encoding.codec = "text"
address = "10.0.0.1:2005"
healthcheck = false
buffer.type = "memory"
buffer.max = 10000
buffer.when_full = "drop_newest"
```

```lua
function process(event,emit)
        local host = hostmap[event.log.host]
        if host == nil then return end
        event.log.message = event.log.message:gsub("^[^. ]*", host)
        emit(event)
end
...
function timer_handler(emit)
        local ts = get_ts()
        if ts == filemod then return end
        read_map()
end
```

### Debug Output

I do not have relevant debug. There are too much logs with debug and they are rotated. And in recent logs there are no traces of the problem.

### Expected Behavior

I receive strings over tcp socket (graphite metrics specifically, but it does not matter), alter them with lua script and send those strings out to three tcp sockets. I expect Vector to send data to all three sinks (tcp sockets). Or at least try to reconnect if there are problems.

### Actual Behavior

After several days of running, Vector just stops sending to some of the sinks. I do not see an established connection in netstat and do not see any attempts to reestablish it in tcpdump.
I have seen that behaviour at least three times already, first time it stopped sending to out2 and out3, and two times out2. I tried to send USR1, but it did not help.

I did not find anything useful in logs, Vector just do not report any errors about it or something else, with LOG=debug last time it showed writes to port 2003 (out1) and port 2005 (out3) and completely nothing about 2004 (out2).

**Comment by ypid-geberit** [comment]
I consider this a serious bug and seeing that this was reported a year ago makes me wonder about prios bugs vs. features. Could this be prioritized? It makes the socket sink that is marked as "stable" not usable (ref: https://vector.dev/docs/reference/configuration/sources/socket/).

I just reproduced it with both the latest stable and nightly:

```
vector 0.17.0 (x86_64-unknown-linux-gnu 06ef4d7 2021-09-10)
vector 0.16.1 (x86_64-unknown-linux-gnu 739e878 2021-08-26)
```

1. Configure socket sink in TCP mode on host `agent`, mini working example (MWE):

```yaml
---
# vim: foldmarker=[[[,]]]:foldmethod=marker

# SPDX-FileCopyrightText: 2021 Robin Schneider <robin.schneider@geberit.com>
#
# SPDX-License-Identifier: CC0-1.0

data_dir: '/tmp'

sources:

  source_stdin:
    type: 'stdin'

sinks:

  sink_socket:
    type: 'socket'
    inputs: ['source_stdin']
    address: 'logs.example.net:5149'
    mode: 'tcp'
    encoding:
      codec: 'json'
    healthcheck:
      enabled: true
```

1. Run a TCP server on host `logs` with a host or network Firewall in between. For example iptables and this Ncat command: `ncat -l -k 5149`
3. Start the vector agent with the MWE config on host `agent`: `vector --config issue_4933.yaml`
4. Type something in the vector agent, press enter. A JSON object should be reveived and written to STDOUT by ncat.
5. Kill the existing TCP session in the Firewall.
6. Repeat 4. Now nothing is received by ncat.
7. Restart Vector, repeat 4. Now ncat receives something again.

**Comment by StephenWakely** [comment]
@ypid-geberit I'm struggling to reproduce this issue. Are you able to provide more details, in particular this stage:

> 5. Kill the existing TCP session in the Firewall.

How exactly are you killing the session?

**Comment by jszwedko** [comment]
Closing due to inactivity, but if anyone else is able to reproduce this, please re-open with reproduction instructions!

**Comment by user318** [comment]
And has anyone of the developers ever tried my example from the initial message?

**Comment by jszwedko** [comment]
Hi @user318!

We did, but weren't able to reproduce which led to this comment: https://github.com/vectordotdev/vector/issues/4933#issuecomment-1076545727

I think we need more details about how you were configuring the firewall and terminating the session.

**Comment by ypid-work** [comment]
Sorry for the delay, I switched jobs and it took awhile until I could start deploying Vector. Can you reopen and rename "vector and tcp sink are unable to recover from killed tcp session, try to tcp retransmit forever"?

## How serious is this?/Executive summary

If an organization has (stateful/normal) firewalls deployed and the connection state table on the firewall is ever cleared for example by a restart of the firewall (if not clustered) or the table is cleared by an admin, then no more logs will be received by the vector server because the vector agent just tries to retransmit using a tcp session the firewall knows nothing about anymore and therefore either drops the packet or sends a reject packet. In either case, the vector agent fails to recover from this condition.

## How to reproduce

Here is how you can reproduce this (step 5.) on Linux, either a Linux Router/Firewall in between or running on the aggregator/server side. Killing the session on the host were the agent runs is also possible but blocking outdoing connections is less common.

* Save the following as `nft.conf`

  ```
  #!/usr/sbin/nft -f

  table inet vector_bug
  delete table inet vector_bug

  table inet vector_bug {
          chain input {
                  type filter hook input priority 0;

                  ct state vmap { established : accept, related : accept, invalid : drop } 

                  tcp dport 5515 tcp flags syn ct state new counter accept
                  # tcp dport 5515 counter drop
                  tcp dport 5515 counter reject
          }
  }
  ```

* Load the table `nft -f nft.conf`
* Kill the session with `iptstate` by pressing x on the matching entry in the conntrack table.

In Wireshark it looks like  this:

![image](https://user-images.githubusercontent.com/97551096/179231991-15bb220e-ee88-4d08-a968-3f0a5e35d133.png)

131 until (including) 137 was with drop. 138 until 141 was with reject. 142 was the shutdown of the vector agent.

Depending on the Firewall config, the TCP session could be continued even if the state was killed. At least configs like https://wiki.nftables.org/wiki-nftables/index.php/Simple_ruleset_for_a_server But a lot of "enterprise" firewalls are configured as I posted above in the nftables config. Only accept new sessions if they start with syn which Vector does not attempt. Therefore it will forever try to re transmit.

I did this test with two Vector instances. `vector 0.22.3 (x86_64-unknown-linux-gnu)`. Vector logs this as it does the tcp retransmits:

```
2022-07-15T14:08:48.771398Z  WARN sink{component_kind="sink" component_id=sink_socket component_type=vector component_name=sink_socket}:request{request_id=3}: vector::sinks::util::retries: Request timed out. If this happens often while the events are actually reaching their destination, try decreasing `batch.max_bytes` and/or using `compression` if applicable. Alternatively `request.timeout_secs` can be increased.
```

I did the same test with Logstash as agent with this config:

```
input { stdin { } }

output {
  tcp {
    host => "logs.example.net"
    port => 5515
  }
}
```

Logstash has the exact same behavior. But I have only waited a few minutes. But I have not researched this in depth.

Then I got curious if the Vector source and sink is also affected. It is!

Agent:

```yaml
---
# vim: foldmarker=[[[,]]]:foldmethod=marker

data_dir: '/tmp'

sources:

  source_stdin:
    type: 'stdin'

sinks:

  sink_socket:
    type: 'vector'
    inputs: ['source_stdin']
    address: 'logs.example.net:5515'
```

Aggregator/server:

```yaml
---
# vim: foldmarker=[[[,]]]:foldmethod=marker

data_dir: '/tmp'

sources:

  source_vector:
    type: 'vector'
    address: '0.0.0.0:5515'

sinks:

  sink_stdout:
    type: 'console'
    inputs: ['source_vector']
    encoding:
      codec: 'json
```

Same behavior. I would have expected that this more complex protocol can recover from this.

## Solution

Try a TCP syn to establish a new connection when running into a timeout.

## Doing the firewall with legacy iptables (you can ignore this)

I first did this with iptables but iptables is legacy so only for reference here because iptables is still widely used:

```
iptables -A INPUT -m conntrack --ctstate RELATED,ESTABLISHED -j ACCEPT
iptables -A INPUT -p tcp --dport 5515 --syn -m conntrack --ctstate NEW -j ACCEPT
iptables -A INPUT -p tcp --dport 5515 -j DROP
```

**Comment by jszwedko** [comment]
Thanks for this detailed reproduction case @ypid-work ! I'll reopen and we can try to dig into this soon.

**Comment by tobz** [comment]
Alright, I'm going to be a slight party pooper here: Vector is doing the best it reasonably can here, and this isn't _really_ a bug. Let me explain why.

As you've pointed out, stateful firewalls, and even common load balancers like IPVS, can either lose their connection tracking tables or have them cleared. This part is very common and I agree that systems must cope with that fact. Ultimately, Vector (or any other application with an established TCP connection) cannot reasonably know if the remote peer is simply taking a long time to respond or if the connection is dead: a RST packet was never sent, so as far as Vector knows, the connection is still established.

The correct solution here (IMO) is to configure TCP keepalives so that the OS starts trying to probe the remote peer when it has been idle long enough, and will eventually detect the peer is dead and forcefully close the connection on the Vector side, triggering Vector to open a new TCP connection. Otherwise, we need to implement sink-specific heartbeats which will often not be possible with things like the `socket` sink.

We do theoretically have support for configuring TCP keepalives for the `socket` sink in TCP mode, as well as for version 1 of the `vector` sink, but I still need to do local testing to make sure that Vector is actually configuring TCP keepalives correctly.

I'll report back shortly with any potential issues that we file as a result of changes/fixes that need to occur to allow using TCP keepalives correctly.

**Comment by jszwedko** [comment]
> Hi @jszwedko @tobz, is there any update for any fixes or workaround for this issue?

No updates yet unfortunately.

**Comment by jcantrill** [comment]
@tobz @jszwedko What is the expected behavior when the socket.keepalive is configured with a value:
* success: continue as if there is no issue
* failed: re-stablish the session?  error and collector restarts?  error and log?

**Comment by jszwedko** [comment]
> [@tobz](https://github.com/tobz) [@jszwedko](https://github.com/jszwedko) What is the expected behavior when the socket.keepalive is configured with a value:
> 
> * success: continue as if there is no issue
> * failed: re-stablish the session?  error and collector restarts?  error and log?

I believe the suggestion above is that we enable TCP keepalives which will consider a connection dead after `tcp_keepalive_probes ` number of probes are not responded to. The expectation would then be that Vector recreates the connection.

**Comment by Kyle-Cooley** [comment]
I'm seeing this issue as well. I'm not a network expert, but figured I would try to figure out what is going wrong. I have two vector instances with one sending data to the other. One of them is using a tcp socket as a sink, the other is using a tcp socket as a source.

<details>
<summary>vector server (tcp source)</summary>

```yaml
sources:
  tcp_syslog:
    type: socket
    address: 127.0.0.1:1514
    mode: tcp

# Parse Syslog logs
# See the Vector Remap Language reference for more info: https://vrl.dev/
transforms:
  parse_logs:
    type: "remap"
    inputs: ["tcp_syslog"]
    source: |
      . = parse_syslog!(string!(.message))

# Print parsed logs to stdout
sinks:
  print:
    type: "console"
    inputs: ["parse_logs"]
    encoding:
      codec: "json"
      json:
        pretty: true
```

</details>

<details>
<summary>vector client (tcp sink)</summary>

```yaml
sources:
  dummy_logs:
    type: "demo_logs"
    format: "syslog"
    interval: 60

# Print parsed logs to stdout
sinks:
  tcp_syslog:
    type: socket
    inputs: ["dummy_logs"]
    address: 127.0.0.1:1514
    mode: tcp
    encoding:
      codec: syslog
```

</details>

I used tcpdump to check the packets.

```shell
tcpdump -n -i lo 'src host 127.0.0.1 and dst host 127.0.0.1'
```

When the vector server instance terminates, I see a FIN packet from the server followed by an ACK by the client.

```
18:56:39.026111 IP 127.0.0.1.fujitsu-dtcns > 127.0.0.1.47186: Flags [F.], seq 1, ack 172, win 64, options [nop,nop,TS val 119269010 ecr 1170176965], length 0                                                       
18:56:39.026506 IP 127.0.0.1.47186 > 127.0.0.1.fujitsu-dtcns: Flags [.], ack 2, win 64, options [nop,nop,TS val 1170184598 ecr 119269010], length 0
```

After that point, the vector server eventually terminates. There are no additional packets before that point. Once the client sends the next payload, I see some more packets.

```
18:57:31.394019 IP 127.0.0.1.47186 > 127.0.0.1.fujitsu-dtcns: Flags [P.], seq 172:345, ack 2, win 64, options [nop,nop,TS val 1170236965 ecr 119269010], length 173
18:57:31.394039 IP 127.0.0.1.fujitsu-dtcns > 127.0.0.1.47186: Flags [R], seq 843372612, win 0, length 0 

18:58:31.394221 IP 127.0.0.1.45290 > 127.0.0.1.fujitsu-dtcns: Flags [S], seq 2841707998, win 65495, options [mss 65495,sackOK,TS val 714319980 ecr 0,nop,wscale 10], length 0
...
```

So the vector client continue to use the connection after receiving the FIN packet until it receives an RST packet.

Running this same experiment in another environment across different hosts the RST packet is never being received by the client. I think that is because it is out of window and is getting dropped somewhere in the middle.

Given that behavior:
1. Should the vector client gracefully close the connection when it receives the FIN packet?
2. Should the vector server send an RST packet before it terminates if it does not see a FIN packet from the client?

**Comment by ypid-work** [comment]
@graphcareful sounds like #25765 fixes this issue. Nice work. I have not tested it but I have left details how to test for it in https://github.com/vectordotdev/vector/issues/4933#issuecomment-1185617943. Were you aware of this old issue?

**Comment by jcantrill** [comment]
@ypid-geberit I read the fix you reference as only applying to the vector sink which does not address the description here.  I suspect any sink would benefit from these changes and thus would not consider this issue closed.
