### ISSUE TITLE
DNSTAP socket shows errors after operating for some time

### ISSUE THREAD

**Issue by johnhtodd** [vectordotdev/vector#20744]
### A note for the community

* Please vote on this issue by adding a 👍 [reaction](https://blog.github.com/2016-03-10-add-reactions-to-pull-requests-issues-and-comments/) to the original issue to help the community and maintainers prioritize this request
* If you are interested in working on this issue or have submitted a pull request, please leave a comment

### Problem

After a period of time, a heavily-loaded DNSTAP ingestion system shows socket errors on connected sockets that are transmitting DNSTAP data to it. Uncertain if this is a reporting error or a real error.

### Configuration

```text
in this config, I use variables for configuration.  
VECTORIPV4=10.10.3.100
VECTORDNSTAPPORT=59001


  main_dnstap_1:
    type: "dnstap"
    mode: tcp
    address: "${VECTORIPV4:?err}:${VECTORDNSTAPPORT:?err}"
    permit_origin: ["${VECTORIPV4NETWORK:?err}", "127.0.0.1/32"]
    lowercase_hostnames: true
```

### Version

vector 0.39.0 (x86_64-unknown-linux-gnu)

### Debug Output

```text
This is not a crash; backtrace not included, though if desired I can attempt it.

2024-06-24T15:18:42.687252Z ERROR source{component_kind="source" component_id=main_dnstap_1 component_type=dnstap}:connection{peer_addr=10.10.3.232:35402}:connection: vector::internal_events::tcp: TCP socket error. error=bytes remaining on stream peer_addr=10.10.3.232:35402 error_type="connection_failed" stage="processing" internal_log_rate_limit=true
2024-06-24T15:18:42.687482Z ERROR source{component_kind="source" component_id=main_dnstap_1 component_type=dnstap}:connection{peer_addr=10.10.3.232:35402}:connection: vector::internal_events::tcp: Internal log [TCP socket error.] is being suppressed to avoid flooding.
```

### Additional Context

This particular system I am testing on has two high-volume (>14kqps each) ingestion streams and two low-volume streams (~30qps each) connected to two different dnsdist instances and feeding two different contexts. After some period of time, errors will jump from zero to around 180,000 per second (which doesn't make sense? How can there be more errors than ingestion elements?  I'm graphing with: "irate(vector_component_errors_total[5m])" in Prometheus/Grafana) on the high-volume context that is importing from the dnstap source.  This I suspect is one of the two server sockets showing signs of the problem.  Then after a random number of hours (often measured in days) the number of errors will jump to around double that amount. (see graph, which shows one stream as being "bad" for several days, then a spike when the other large stream starts showing errors.) 

Strangely, I see no evidence of this increased error rate on any of the downstream components, either looking in their graph data (I graph pretty much everything coming out of Vector) nor on the actual output generated at the end of the pipelines.  Are these errors real?  The debug messages certainly seem to indicate that there is a problem.

Other items of note: Reloading vector does not cure the problem.  Even more unusually, "systemctl restart vector" also does not cure the problem.  Only "systemctl stop vector;systemctl start vector" causes the error graph to drop to zero and the error messages to stop being generated.

This machine is fairly heavily loaded, performing only Vector tasks (>85% utilization on htop across all cores at some parts of the day.) 

There are other DNSTAP parsing errors seen sporadically, but they seem to be related to malformed DNS packets or elements in the DNSTAP message that are not yet parsed fully.  I did not include those log lines.

I have other protobuf sockets operating on this system that are fairly busy (four at ~3kqps each) but which are not DNSTAP.  I also have many v6 kafka streams as sinks.

![Screen Shot 2024-06-24 at 8 38 08 AM](https://github.com/vectordotdev/vector/assets/9668137/dd8ae900-317f-4074-a3eb-861af89113e6)

**Comment by james-stevens** [comment]
Hey John, what's the `dnstap` source ?

`error=bytes remaining on stream` sounds to me like vector thought there were errors in the frame format

**Comment by johnhtodd** [comment]
> Hey John, what's the `dnstap` source ?
> 
> `error=bytes remaining on stream` sounds to me like vector thought there were errors in the frame format

The source is dnstap (latest release.)  It may be the case that dnstap sends an error of some sort, but that should be only for one event.  And vector goes many days without falling into this error condition, with the same load all the time.  It would be highly unexpected for dnstap to suddenly shift to an "all-errors" modality, since there is no backwards data sent from vector to dnstap - it should be just "ack" packets. Also, the fact that the stats don't seem to change, just the error counters rise, seems to be unusual and points away from dnstap being the source of the issue. Lastly, there is no increase in packet or byte count between the DNSTAP origin and this vector host as indicated via my node graphs, so I don't think this is a dnstap-side issue, or at least not the ongoing large jump in error counters.

**Comment by johnhtodd** [comment]
Update: In my last event instance today, "systemctl restart vector" did clear the error condition.

**Comment by esensar** [comment]
Looking at the code, I think @james-stevens is right - it comes from the frame reader. The odd thing to me here is that there is no other effect than higher error count, since this should pretty much stop any events from flowing - error frames are just skipped.

**Comment by james-stevens** [comment]
We've been running `dnsdist`->`vector` using the `dnstap` source and had no framing issues up to 200K event/s - the problem we have is we've not been able to find any vector sink that can sink the data at anywhere near that rate, except `blackhole` !!! https://github.com/vectordotdev/vector/issues/20739

So what we get is back-pressure at the sink, which causes dropped frames at the `dnsdist` end of the `dnstap` socket. `dnsdist` will deliberately drop frames instead of blocking as that would disrupt the DNS service. But it doesn't cause framing issues.

`dnsdist` only makes a single `dnstap` connection to vector, for all its threads - whereas PowerDNS Recursor makes one `dnstap` per-thread - obv the latter makes scaling much easier!!

Our servers have plenty of spare capacity & none of the vector threads are over 20% CPU, so its really not clear where the bottleneck is - but that's a different problem!!!

**Comment by esensar** [comment]
Thanks @james-stevens. Do you have a way of testing `dnstap` in `unix` mode? Just to help pinpoint the issue. If it only occurs in `tcp` mode then this and #20739 might be related.

**Comment by johnhtodd** [comment]
Another point to notice that I haven't mentioned: the number of errors, once started, seems to be remarkably "flat" despite the number of events being sent to the DNSTAP source fluctuating quite a bit, at least according to what is being recorded by the prometheus metrics in Vector.  We shift from 16k events per second to 26k events per second being sent by dnsdist to the DNSTAP consumer, but the error rate shown in the graphs above stays nearly exactly at 18.2k errors per second - the values are not as important as the fact that there is no variation in the error rate despite variation in the dnstap message transmission rate.  Just as weird, the rate of events per second downstream from the dnstap ingestion remap fluctuates normally with volume, so the rest of the system does not "see" these errors that are triggering faults that are showing up in the graph associated with vector_component_errors_total.

**Comment by james-stevens** [comment]
what metric(s) are you looking at in that graph?

we're not getting the metric `vector_component_errors_total` which I suspect is cos we have `expire_metrics_secs` set to five mins - so if we're seeing no errors that metric could just get removed.

What I check is that `vector_buffer_sent_events_total` matches what I expect to the appropriate sink.

**Comment by johnhtodd** [comment]
Yes, the metric is "vector_component_errors_total".  Our expire_metrics_secs is set to 22265 (yes, very long because we have metric aggregations that go for >6 hours in some cases.)

**Comment by james-stevens** [comment]
I can only see errors related to scraping metrics when under load - we use vector to aggregate all the metrics on the server so Prometheus doesn't need to be reconfigured every time we change things about.

We also had a few "disk full" incidents when running 300Kq/s tests for five mins. 350MB/s disk writes adds up fast.

The way we look for dropped frames is to get `dnsdist` to log - its one of the items it logs. 

We then wrote some LUA to parse the log line & convert it into three new dnsdist metrics - dnstap frames sent, dropped & failed. No idea the difference between those last two, but we don't see any failed, just dropped when the load gets too high.

**Comment by johnhtodd** [comment]
Still seeing this problem on dnstap sockets, but we have not yet added the pooling on our production platform.  We have vector instances that are ingesting dnstap (2 sockets on different ports) and protobuf (2 sockets, different ports) and the protobuf streams keep going but one of the dnstap sockets gets "hung" and does not accept or process any new messages according to "vector top".  Only restarting vector cures the condition.

**Comment by johnhtodd** [comment]
Still not using mulit-socket pooling here, but I did find some additional information on the problem.

When vector had gone into a "locked" state and as no longer able to accept new dnstap messages, I tried resetting one of the dnsdist instances that is sending dnstap data, and ran a packet trace (tshark) just on the conversation between vector and that host.  I see the session start actively sending data for a few seconds, in what seems to be "normal" dnstap transmission processing. However, after about 20 seconds, I see this transaction:

```
  582 24.058998153 fd99:2620:fe:e016:24bf:1924:e5b0:67d → fd99:2620:fe:e016:1f36:809d:f0f5:827f TCP 1420 55812 → 59001 [ACK] Seq=1057871 Ack=43 Win=27648 Len=1348 TSval=2539670096 TSecr=2483775150
  583 24.059034268 fd99:2620:fe:e016:24bf:1924:e5b0:67d → fd99:2620:fe:e016:1f36:809d:f0f5:827f TCP 1420 55812 → 59001 [ACK] Seq=1059219 Ack=43 Win=27648 Len=1348 TSval=2539670096 TSecr=2483775150
  584 24.059054174 fd99:2620:fe:e016:24bf:1924:e5b0:67d → fd99:2620:fe:e016:1f36:809d:f0f5:827f TCP 2768 55812 → 59001 [ACK] Seq=1060567 Ack=43 Win=27648 Len=2696 TSval=2539670096 TSecr=2483775150
  585 24.101892691 fd99:2620:fe:e016:1f36:809d:f0f5:827f → fd99:2620:fe:e016:24bf:1924:e5b0:67d TCP 72 59001 → 55812 [ACK] Seq=43 Ack=1063263 Win=384 Len=0 TSval=2483775194 TSecr=2539670096
  586 24.341990015 fd99:2620:fe:e016:24bf:1924:e5b0:67d → fd99:2620:fe:e016:1f36:809d:f0f5:827f TCP 456 [TCP Window Full] 55812 → 59001 [PSH, ACK] Seq=1063263 Ack=43 Win=27648 Len=384 TSval=2539670379 TSecr=2483775194
  587 24.342031003 fd99:2620:fe:e016:1f36:809d:f0f5:827f → fd99:2620:fe:e016:24bf:1924:e5b0:67d TCP 72 [TCP ZeroWindow] 59001 → 55812 [ACK] Seq=43 Ack=1063647 Win=0 Len=0 TSval=2483775434 TSecr=2539670379
  588 24.577204894 fd99:2620:fe:e016:24bf:1924:e5b0:67d → fd99:2620:fe:e016:1f36:809d:f0f5:827f TCP 72 [TCP Keep-Alive] 55812 → 59001 [ACK] Seq=1063646 Ack=43 Win=27648 Len=0 TSval=2539670615 TSecr=2483775434
  589 24.577235422 fd99:2620:fe:e016:1f36:809d:f0f5:827f → fd99:2620:fe:e016:24bf:1924:e5b0:67d TCP 72 [TCP ZeroWindow] 59001 → 55812 [ACK] Seq=43 Ack=1063647 Win=0 Len=0 TSval=2483775669 TSecr=2539670379
  590 25.048205672 fd99:2620:fe:e016:24bf:1924:e5b0:67d → fd99:2620:fe:e016:1f36:809d:f0f5:827f TCP 72 [TCP Keep-Alive] 55812 → 59001 [ACK] Seq=1063646 Ack=43 Win=27648 Len=0 TSval=2539671086 TSecr=2483775669
  591 25.990272584 fd99:2620:fe:e016:24bf:1924:e5b0:67d → fd99:2620:fe:e016:1f36:809d:f0f5:827f TCP 72 [TCP Keep-Alive] 55812 → 59001 [ACK] Seq=1063646 Ack=43 Win=27648 Len=0 TSval=2539672028 TSecr=2483775669
```

The "TCP Window full" message seems to indicate the moment that the two systems stop the activity (obviously) and then the TCP messaging goes into a state of quiescence, with only keep-alives sent between the two hosts.  The socket remains open, but no data flows.

What inside of Vector would cause such a message to be transmitted, and then NEVER resolved?  Is there any way to close/reset the connection after Vector gets into this state, via a watchdog?  A socket should probably not ever be able to get into a condition where it stops receiving data, but remains open.

Additional notes: this same host and vector instance is processing huge volumes of protobuf messages (non-dnstap) and also receiving small numbers of other dnstap messages on a different socket and component chain, so the process itself is not stopped.  Just these sets of sockets with dnstap data.

The long-term solution I think is to spread the load of this data set out across many sockets, but that does not actually address this bug, which is that sockets get stuck.  In fact, spreading load across many sockets may cause really REALLY difficult-to-detect problems where some sockets get stuck, and others do not.

**Comment by johnhtodd** [comment]
More updates now that I re-read some of my older notes:  
1) "systemctl restart vector" does in fact cure the problem.  

2) This is pretty clearly load-related, but I can't say if it is a "magic packet" that causes the issue.  Time frames range from 10 minutes to 2 hours between halts on this stream set.  

3) The number of events being processed is actually quite small, though the problems happen regularly only on our largest ingestion hosts. I've kept reducing the number of messages transmitted in this test case using dnsdist's "probarule" function, so we were at around 6k per second, then went to 3k, and now down to 1k.  At 1k, the system stays fairly stable (so far, at least) but that is nowhere near where we need to be.  I am uncertain if this is load-related (which looks very likely) or if it is a "magic packet" causing the fault.

4) In my test (prior note) with restarting just one dnstap instance, I just looked at the "component_sent_events_total" metric for my dnstap source.  It still reads 0 for the 20 seconds of packet dump activity that looked normal.  So while it appeared that dnstap packets were being ingested into the dnstap vector source, but they were not changing the counter.

**Comment by johnhtodd** [comment]
Update: I think I may be describing a different problem in the last few days than the one that I originally opened here. The quantity of errors is not high any more, as was the original description.  I'm not sure if I should open a new ticket on this failure mode or keep editing this one, and I have not seen the high volumes of errors as I originally reported since we have essentially been backing off on dnstap volumes until they're somewhat absurdly low. I do not know if the original fault is resolved or not, but we need to get this problem sorted out and then I can move back to testing if the high-volume dnstap problem still exists.

**Comment by esensar** [comment]
There might be a couple of different issues here, I will try to go through them one by one. The easiest ones to spot are the error messages coming from `hickory-proto`:


> May 18 21:07:23 tel410.ams vector[69962]: 2025-05-18T21:07:23.091196Z  WARN dnstap_parser::internal_events: Recoverable error occurred while parsing dnstap data. error=Encountered error from TrustDns: more than one edns record present stage="processing" error_type="parser_failed" internal_log_rate_limit=true

This one got here from: https://github.com/hickory-dns/hickory-dns/blob/ff7d61cb359968a9e190e2ff7c6f9511f7902234/crates/proto/src/op/message.rs#L710 - multiple OPT records were found in additional data.

> May 18 21:08:02 tel410.ams vector[69962]: 2025-05-18T21:08:02.498256Z  WARN dnstap_parser::internal_events: Recoverable error occurred while parsing dnstap data. error=Encountered error from TrustDns: unrecognized label code: 1101110 stage="processing" error_type="parser_failed" internal_log_rate_limit=true

It seems that only label codes matching `11xxxxxx` (pointers) and `00xxxxxx` (labels) are accepted. I need to check if that is right - this might be an alright message.

**Comment by johnhtodd** [comment]
> There might be a couple of different issues here, I will try to go through them one by one. The easiest ones to spot are the error messages coming from `hickory-proto`:
> 
> > May 18 21:07:23 tel410.ams vector[69962]: 2025-05-18T21:07:23.091196Z  WARN dnstap_parser::internal_events: Recoverable error occurred while parsing dnstap data. error=Encountered error from TrustDns: more than one edns record present stage="processing" error_type="parser_failed" internal_log_rate_limit=true
> 
> This one got here from: https://github.com/hickory-dns/hickory-dns/blob/ff7d61cb359968a9e190e2ff7c6f9511f7902234/crates/proto/src/op/message.rs#L710 - multiple OPT records were found in additional data.

Well, perhaps we are now at the stage where we need to return EDNS records as an array.  The ability of EDE (Extended DNS Errors) to convey multiple flags is probably going to create more and more multi-EDNS responses, so we need to start considering that if it's not already returning an array.  The parsing of DNSTAP to handle multiple EDNS needs to be future-proofed.  This is perhaps a side quest, but there is a non-zero chance it may be related to the core problem being described in this ticket. Multiple EDE messages can be present in all response types not just failures. I suppose that is coding/discussion question for the Hickory-DNS github tracker, or would that be here?


> > May 18 21:08:02 tel410.ams vector[69962]: 2025-05-18T21:08:02.498256Z  WARN dnstap_parser::internal_events: Recoverable error occurred while parsing dnstap data. error=Encountered error from TrustDns: unrecognized label code: 1101110 stage="processing" error_type="parser_failed" internal_log_rate_limit=true
> 
> It seems that only label codes matching `11xxxxxx` (pointers) and `00xxxxxx` (labels) are accepted. I need to check if that is right - this might be an alright message.
> 
> I can't find usages of reserved `10` prefix, but I can see that `01` (which seems to have most occurences in your set) represents extended label types, which are deprecated (https://www.rfc-editor.org/rfc/rfc6891.html#section-5). I guess it would be best not to implement these at all (that would have to be done in `hickory-proto` anyways), because it would introduce additional maintenance burden for a deprecated feature.

Entirely acceptable to not parse deprecated codes, but I'd prefer that they weren't lost.  What happens to events that have non-parseable labels?  Is the label dropped, or is some error text returned in a different part of the message, or...?

In any case they shouldn't cause an issue that creates lockup on a thread or in some other way, if indeed that is happening.

**Comment by esensar** [comment]
> Well, perhaps we are now at the stage where we need to return EDNS records as an array. The ability of EDE (Extended DNS Errors) to convey multiple flags is probably going to create more and more multi-EDNS responses, so we need to start considering that if it's not already returning an array. The parsing of DNSTAP to handle multiple EDNS needs to be future-proofed. This is perhaps a side quest, but there is a non-zero chance it may be related to the core problem being described in this ticket. Multiple EDE messages can be present in all response types not just failures. I suppose that is coding/discussion question for the Hickory-DNS github tracker, or would that be here?

It is already supported in hickory proto - there was an issue that didn't allow multiple records with the same code, but we got that patched in https://github.com/hickory-dns/hickory-dns/pull/2151. This issue related to multiple OPT RRs (which is not allowed if I understand correctly: https://datatracker.ietf.org/doc/html/rfc6891#section-6.1.1). Multiple EDNS records are stored in a single OPT RR (https://datatracker.ietf.org/doc/html/rfc6891#section-6.1.2).


> Entirely acceptable to not parse deprecated codes, but I'd prefer that they weren't lost. What happens to events that have non-parseable labels? Is the label dropped, or is some error text returned in a different part of the message, or...?

Looks like the message is left in raw representation in that case (or any other parsing failure) and error text is stored in the "error" field.

> In any case they shouldn't cause an issue that creates lockup on a thread or in some other way, if indeed that is happening.

Yeah, this shouldn't be the cause of these lockups. I am pretty sure that the TCP DNSTAP source implementation has some issues, but I haven't found them yet. There are quite a few differences compared to TCP socket source, which doesn't have these issues.
