### ISSUE TITLE
unable to receive syslog from fortigate

### ISSUE THREAD

**Issue by Inasayang** [vectordotdev/vector#20886]
### A note for the community

* Please vote on this issue by adding a 👍 [reaction](https://blog.github.com/2016-03-10-add-reactions-to-pull-requests-issues-and-comments/) to the original issue to help the community and maintainers prioritize this request
* If you are interested in working on this issue or have submitted a pull request, please leave a comment

### Problem

Vector (listen on udp 514) unable to receive syslog from fortigate. 
But using tcpdump to capture the packet, you can see this.
```
10:34:35.918057 IP {src.ip}.19201 > {dst.ip}.syslog: SYSLOG local7.notice, length: 724
10:34:35.918766 IP {src.ip}.19201 > {dst.ip}.syslog: SYSLOG local7.notice, length: 661
10:34:35.919081 IP {src.ip}.5330 > {dst.ip}.syslog: SYSLOG local7.notice, length: 661
10:34:36.149202 IP {src.ip}.19201 > {dst.ip}.syslog: SYSLOG local7.notice, length: 651
10:34:36.183806 IP {src.ip}.5330 > {dst.ip}.syslog: SYSLOG local7.notice, length: 651
10:34:36.213159 IP {src.ip}.19201 > {dst.ip}.syslog: SYSLOG local7.notice, length: 651
10:34:36.246107 IP {src.ip}.5330 > {dst.ip}.syslog: SYSLOG local7.notice, length: 651
10:34:36.276887 IP {src.ip}.19201 > {dst.ip}.syslog: SYSLOG local7.notice, length: 651
10:34:36.339787 IP {src.ip}.5330 > {dst.ip}.syslog: SYSLOG local7.notice, length: 663
10:34:36.340008 IP {src.ip}.19201 > {dst.ip}.syslog: SYSLOG local7.notice, length: 663
10:34:36.355218 IP {src.ip}.5330 > {dst.ip}.syslog: SYSLOG local7.notice, length: 651
10:34:36.410994 IP {src.ip}.5330 > {dst.ip}.syslog: SYSLOG local7.notice, length: 766
10:34:36.428832 IP {src.ip}.19201 > {dst.ip}.syslog: SYSLOG local7.notice, length: 661
10:34:36.428967 IP {src.ip}.5330 > {dst.ip}.syslog: SYSLOG local7.notice, length: 661
10:34:36.515032 IP {src.ip}.19201 > {dst.ip}.syslog: SYSLOG local7.notice, length: 661
10:34:36.515505 IP {src.ip}.5330 > {dst.ip}.syslog: SYSLOG local7.notice, length: 661
10:34:36.681859 IP {src.ip}.19201 > {dst.ip}.syslog: SYSLOG local7.notice, length: 724
10:34:36.789248 IP {src.ip}.5330 > {dst.ip}.syslog: SYSLOG local7.notice, length: 604
10:34:36.937179 IP {src.ip}.19201 > {dst.ip}.syslog: SYSLOG local7.notice, length: 661
10:34:36.938007 IP {src.ip}.5330 > {dst.ip}.syslog: SYSLOG local7.notice, length: 661
```
If switch to rsyslog, it can receive syslog.

### Version

vector 0.38.0 (x86_64-unknown-linux-gnu ea0ec6f 2024-05-07 14:34:39.794027186)

**Comment by jszwedko** [comment]
Hi @Inasayang ,

I think we'll need some more info to debug this. Can you provide:

- What you mean by "unable to receive". Do you mean that Vector receives none of the traffic? It fails to parse the incoming records? Something else? If you could provide the Vector logs that might provide more clues
- Are you sure the traffic is being sent to the right port and using the right protocol (tcp vs udp)?

**Comment by Inasayang** [comment]
vector config:
```yaml
sources:
  remote_syslog:
    type: syslog
    mode: tcp
    address: "0.0.0.0:514"
    max_length: 10240
sinks:
  syslog_std:
    type: console
    encoding:
      codec: "json" 
    inputs:
      - remote_syslog
```

The log is as follows：
```
Jul 19 11:08:59 _gateway date=2024-07-19 time=11:05:36 devname=FG100D3G14827840 devid=FG100D3G14827840 logid=0000000013 type=traffic subtype=forward level=notice vd=root srcip=192.168.1.251 srcport=64064 srcintf="lan" dstip=223.5.5.5 dstport=53 dstintf="wan1" sessionid=16674375 status=accept policyid=2 dstcountry="China" srccountry="Reserved" trandisp=snat transip=219.137.229.21 transport=64064 service=DNS proto=17 appid=16195 app="DNS" appcat="Network.Service" applist="default" appact=detected duration=181 sentbyte=221 rcvdbyte=133 sentpkt=2 rcvdpkt=1 utmaction=passthrough utmevent=app-ctrl attack="DNS"
Jul 19 11:08:59 _gateway date=2024-07-19 time=11:05:36 devname=FG100D3G14827840 devid=FG100D3G14827840 logid=0000000013 type=traffic subtype=forward level=notice vd=root srcip=192.168.1.142 srcport=53462 srcintf="lan" dstip=114.114.114.114 dstport=53 dstintf="wan1" sessionid=16674378 status=accept policyid=2 dstcountry="China" srccountry="Reserved" trandisp=snat transip=219.137.229.18 transport=53462 service=DNS proto=17 appid=16195 app="DNS" appcat="Network.Service" applist="default" appact=detected duration=181 sentbyte=64 rcvdbyte=247 sentpkt=1 rcvdpkt=1 utmaction=passthrough utmevent=app-ctrl attack="DNS"
Jul 19 11:08:59 _gateway date=2024-07-19 time=11:05:36 devname=FG100D3G14827840 devid=FG100D3G14827840 logid=0000000013 type=traffic subtype=forward level=notice vd=root srcip=192.168.1.142 srcport=56128 srcintf="lan" dstip=114.114.114.114 dstport=53 dstintf="wan1" sessionid=16674379 status=accept policyid=2 dstcountry="China" srccountry="Reserved" trandisp=snat transip=219.137.229.18 transport=56128 service=DNS proto=17 appid=16195 app="DNS" appcat="Network.Service" applist="default" appact=detected duration=181 sentbyte=64 rcvdbyte=199 sentpkt=1 rcvdpkt=1 utmaction=passthrough utmevent=app-ctrl attack="DNS"
```

run vector:
```
[root@localhost vector]# vector -c ./vector.yaml
2024-07-22T01:28:02.219975Z  INFO vector::app: Log level is enabled. level="info"
2024-07-22T01:28:02.220433Z  INFO vector::app: Loading configs. paths=["vector.yaml"]
2024-07-22T01:28:02.221593Z  INFO vector::topology::running: Running healthchecks.
2024-07-22T01:28:02.221643Z  INFO vector: Vector has started. debug="false" version="0.39.0" arch="x86_64" revision="73da9bb 2024-06-17 16:00:23.791735272"
2024-07-22T01:28:02.221645Z  INFO vector::topology::builder: Healthcheck passed.
2024-07-22T01:28:02.221653Z  INFO vector::app: API is disabled, enable by setting `api.enabled` to `true` and use commands like `vector top`.
2024-07-22T01:28:02.221693Z  INFO source{component_kind="source" component_id=remote_syslog component_type=syslog}: vector::sources::syslog: Listening. addr=0.0.0.0:514 type="udp"
2024-07-22T01:28:02.479094Z ERROR source{component_kind="source" component_id=remote_syslog component_type=syslog}: vector::internal_events::codecs: Failed deserializing frame. error=unable to parse input as valid syslog message error_code="decoder_deserialize" error_type="parser_failed" stage="processing" internal_log_rate_limit=true
2024-07-22T01:28:02.479139Z ERROR source{component_kind="source" component_id=remote_syslog component_type=syslog}: vector::internal_events::socket: Error receiving data. error=ParsingError(unable to parse input as valid syslog message) error_code="socket_receive" error_type="reader_failed" stage="receiving" mode=udp internal_log_rate_limit=true
2024-07-22T01:28:02.498926Z ERROR source{component_kind="source" component_id=remote_syslog component_type=syslog}: vector::internal_events::codecs: Internal log [Failed deserializing frame.] is being suppressed to avoid flooding.
2024-07-22T01:28:02.498960Z ERROR source{component_kind="source" component_id=remote_syslog component_type=syslog}: vector::internal_events::socket: Internal log [Error receiving data.] is being suppressed to avoid flooding.
2024-07-22T01:28:12.669375Z ERROR source{component_kind="source" component_id=remote_syslog component_type=syslog}: vector::internal_events::codecs: Internal log [Failed deserializing frame.] has been suppressed 36 times.
2024-07-22T01:28:12.669391Z ERROR source{component_kind="source" component_id=remote_syslog component_type=syslog}: vector::internal_events::codecs: Failed deserializing frame. error=unable to parse input as valid syslog message error_code="decoder_deserialize" error_type="parser_failed" stage="processing" internal_log_rate_limit=true
2024-07-22T01:28:12.669410Z ERROR source{component_kind="source" component_id=remote_syslog component_type=syslog}: vector::internal_events::socket: Internal log [Error receiving data.] has been suppressed 36 times.
2024-07-22T01:28:12.669414Z ERROR source{component_kind="source" component_id=remote_syslog component_type=syslog}: vector::internal_events::socket: Error receiving data. error=ParsingError(unable to parse input as valid syslog message) error_code="socket_receive" error_type="reader_failed" stage="receiving" mode=udp internal_log_rate_limit=true
2024-07-22T01:28:13.499390Z ERROR source{component_kind="source" component_id=remote_syslog component_type=syslog}: vector::internal_events::codecs: Internal log [Failed deserializing frame.] is being suppressed to avoid flooding.
2024-07-22T01:28:13.499419Z ERROR source{component_kind="source" component_id=remote_syslog component_type=syslog}: vector::internal_events::socket: Internal log [Error receiving data.] is being suppressed to avoid flooding.
^C2024-07-22T01:28:15.208463Z  INFO vector::signal: Signal received. signal="SIGINT"
2024-07-22T01:28:15.208506Z  INFO vector: Vector has stopped.
```
I found some similar issues. 
- https://github.com/vectordotdev/vector/issues/12013
- https://github.com/vectordotdev/vector/issues/4852

It seems that it does not comply with rfc5424.

**Comment by jszwedko** [comment]
Thanks @Inasayang ,

The log you provided:

```
Jul 19 11:08:59 _gateway date=2024-07-19 time=11:05:36 devname=FG100D3G14827840 devid=FG100D3G14827840 logid=0000000013 type=traffic subtype=forward level=notice vd=root srcip=192.168.1.251 srcport=64064 srcintf="lan" dstip=223.5.5.5 dstport=53 dstintf="wan1" sessionid=16674375 status=accept policyid=2 dstcountry="China" srccountry="Reserved" trandisp=snat transip=219.137.229.21 transport=64064 service=DNS proto=17 appid=16195 app="DNS" appcat="Network.Service" applist="default" appact=detected duration=181 sentbyte=221 rcvdbyte=133 sentpkt=2 rcvdpkt=1 utmaction=passthrough utmevent=app-ctrl attack="DNS"
```

seems to be an RFC3164 Syslog message. It should be valid. I was able to parse it using VRL, which uses the same syslog parsing library that the `syslog` source uses: https://playground.vrl.dev/?state=eyJwcm9ncmFtIjoiLiA9IHBhcnNlX3N5c2xvZyEocydKdWwgMTkgMTE6MDg6NTkgX2dhdGV3YXkgZGF0ZT0yMDI0LTA3LTE5IHRpbWU9MTE6MDU6MzYgZGV2bmFtZT1GRzEwMEQzRzE0ODI3ODQwIGRldmlkPUZHMTAwRDNHMTQ4Mjc4NDAgbG9naWQ9MDAwMDAwMDAxMyB0eXBlPXRyYWZmaWMgc3VidHlwZT1mb3J3YXJkIGxldmVsPW5vdGljZSB2ZD1yb290IHNyY2lwPTE5Mi4xNjguMS4yNTEgc3JjcG9ydD02NDA2NCBzcmNpbnRmPVwibGFuXCIgZHN0aXA9MjIzLjUuNS41IGRzdHBvcnQ9NTMgZHN0aW50Zj1cIndhbjFcIiBzZXNzaW9uaWQ9MTY2NzQzNzUgc3RhdHVzPWFjY2VwdCBwb2xpY3lpZD0yIGRzdGNvdW50cnk9XCJDaGluYVwiIHNyY2NvdW50cnk9XCJSZXNlcnZlZFwiIHRyYW5kaXNwPXNuYXQgdHJhbnNpcD0yMTkuMTM3LjIyOS4yMSB0cmFuc3BvcnQ9NjQwNjQgc2VydmljZT1ETlMgcHJvdG89MTcgYXBwaWQ9MTYxOTUgYXBwPVwiRE5TXCIgYXBwY2F0PVwiTmV0d29yay5TZXJ2aWNlXCIgYXBwbGlzdD1cImRlZmF1bHRcIiBhcHBhY3Q9ZGV0ZWN0ZWQgZHVyYXRpb249MTgxIHNlbnRieXRlPTIyMSByY3ZkYnl0ZT0xMzMgc2VudHBrdD0yIHJjdmRwa3Q9MSB1dG1hY3Rpb249cGFzc3Rocm91Z2ggdXRtZXZlbnQ9YXBwLWN0cmwgYXR0YWNrPVwiRE5TXCInKSIsImV2ZW50Ijp7fSwiaXNfanNvbmwiOmZhbHNlLCJlcnJvciI6bnVsbH0%3D

The config you provided doesn't seem to match the logs you provided. The configuration configures the source to listen for TCP traffic on 514 but the logs show UDP. Which is expected?

I would suggest trying to swap out the `syslog` source for a `socket` source that receives the raw data and add a `remap` transform that parses the data as syslog that way you can log the messages that aren't parsed correctly. Something like:

```
parsed, err = parse_syslog(.message)
if err != null {
  log(.message) # log out the message that wasn't parsed correctly
}
```

**Comment by Inasayang** [comment]
Thanks for the solution.
I've changed the source from `syslog` to `socket`, and it works.
But if the source is `syslog`, whether it is `tcp` or `udp`, the above error will still occur.

**Comment by jszwedko** [comment]
It sounds like the incoming data isn't valid syslog. The examples you provided were though.

In any event, do you need any more help here or can we close this out?

**Comment by nikriaz** [comment]
Default Fortigate syslog format is absolutely proprietary and cannot be parsed by Vector's syslog parser but if switch syslog format on Fortigate by `set format rfc5424` then it works as is, no `socket ` is required. Default Fortigate syslog format captured by `socket ` can be parsed as a key-value pairs from a text.
